name;location;unit;reference product;UVEK name;UVEK location;UVEK unit;UVEK ref prod
lubricating oil production;RoW;kilogram;lubricating oil;Lubricating oil, at plant;RER;kilogram;Lubricating oil, at plant
market for lubricating oil;RER;kilogram;lubricating oil;Lubricating oil, at plant;RER;kilogram;Lubricating oil, at plant
market for lubricating oil;RoW;kilogram;lubricating oil;Lubricating oil, at plant;RER;kilogram;Lubricating oil, at plant
market for magnesium oxide;GLO;kilogram;magnesium oxide;Magnesium oxide, at plant;RER;kilogram;Magnesium oxide, at plant
market for magnesium sulfate;GLO;kilogram;magnesium sulfate;Magnesium sulphate, at plant;RER;kilogram;Magnesium sulphate, at plant
market for maize seed, for sowing;GLO;kilogram;maize seed, for sowing;maize seed organic, at regional storehouse/kg;CH;kilogram;maize seed organic, at regional storehouse/kg
market for manual dismantling of used electric passenger car;GLO;unit;manual dismantling of used electric passenger car;disposal, powertrain, for electric passenger car;RER;kilogram;disposal, powertrain, for electric passenger car
market for manual dismantling of used passenger car with internal combustion engine;GLO;unit;manual dismantling of used passenger car with internal combustion engine;Disposal, passenger car;RER;unit;Disposal, passenger car
metal coating facility construction;RoW;unit;metal coating facility;Metal coating plant;RER;unit;Metal coating plant
market for metal working factory;GLO;unit;metal working factory;Metal working factory;RER;unit;Metal working factory
market for metal working, average for aluminium product manufacturing;GLO;kilogram;metal working, average for aluminium product manufacturing;Aluminium product manufacturing, average metal working;RER;kilogram;Aluminium product manufacturing, average metal working
metal working, average for aluminium product manufacturing;RoW;kilogram;metal working, average for aluminium product manufacturing;Aluminium product manufacturing, average metal working;RER;kilogram;Aluminium product manufacturing, average metal working
metal working, average for chromium steel product manufacturing;RER;kilogram;metal working, average for chromium steel product manufacturing;Chromium steel product manufacturing, average metal working;RER;kilogram;Chromium steel product manufacturing, average metal working
metal working, average for chromium steel product manufacturing;RoW;kilogram;metal working, average for chromium steel product manufacturing;Chromium steel product manufacturing, average metal working;RER;kilogram;Chromium steel product manufacturing, average metal working
market for metal working, average for copper product manufacturing;GLO;kilogram;metal working, average for copper product manufacturing;Copper product manufacturing, average metal working;RER;kilogram;Copper product manufacturing, average metal working
market for metal working, average for metal product manufacturing;GLO;kilogram;metal working, average for metal product manufacturing;Metal product manufacturing, average metal working;RER;kilogram;Metal product manufacturing, average metal working
market for metal working, average for steel product manufacturing;GLO;kilogram;metal working, average for steel product manufacturing;Steel product manufacturing, average metal working;RER;kilogram;Steel product manufacturing, average metal working
market for methanol;GLO;kilogram;methanol;Methanol, at regional storage;CH;kilogram;Methanol, at regional storage
market for monoethanolamine;GLO;kilogram;monoethanolamine;Monoethanolamine, at plant;RER;kilogram;Monoethanolamine, at plant
market for municipal solid waste;RoW;kilogram;municipal solid waste;disposal, municipal solid waste, 22.9% water, to municipal incineration/kg;CH;kilogram;disposal, municipal solid waste, 22.9% water, to municipal incineration/kg
market for natural gas, from high pressure network (1-5 bar), at service station;GLO;kilogram;natural gas, from high pressure network (1-5 bar), at service station;Natural gas, from high pressure network (1-5 bar), at service station;CH;kilogram;Natural gas, from high pressure network (1-5 bar), at service station
market for natural gas, from medium pressure network (0.1-1 bar), at service station;GLO;kilogram;natural gas, from medium pressure network (0.1-1 bar), at service station;Natural gas, from medium pressure network (0.1-1 bar), at service station;CH;kilogram;Natural gas, from medium pressure network (0.1-1 bar), at service station
market group for natural gas, high pressure;Europe without Switzerland;cubic meter;natural gas, high pressure;Natural gas, from high pressure network (1-5 bar), at service station;CH;kilogram;Natural gas, from high pressure network (1-5 bar), at service station
market for nickel, 99.5%;GLO;kilogram;nickel, 99.5%;Nickel, 99.5%, at plant;GLO;kilogram;Nickel, 99.5%, at plant
nickel mine operation, sulfidic ore;GLO;kilogram;nickel, 99.5%;Nickel, 99.5%, at plant;GLO;kilogram;Nickel, 99.5%, at plant
nitric acid production, product in 50% solution state;RER;kilogram;nitric acid, without water, in 50% solution state;Nitric acid, 50% in H2O, at plant;RER;kilogram;Nitric acid, 50% in H2O, at plant
market for nitrogen fertiliser, as N;GLO;kilogram;nitrogen fertiliser, as N;nitro-compounds, at regional storehouse/kg;RER;kilogram;nitro-compounds, at regional storehouse/kg
market for nitrogen, liquid;RoW;kilogram;nitrogen, liquid;Nitrogen, liquid, at plant;RER;kilogram;Nitrogen, liquid, at plant
market for N-methyl-2-pyrrolidone;GLO;kilogram;N-methyl-2-pyrrolidone;N-methyl-2-pyrrolidone, at plant;RER;kilogram;N-methyl-2-pyrrolidone, at plant
market for nylon 6;RoW;kilogram;nylon 6;Nylon 6, at plant;RER;kilogram;Nylon 6, at plant
market for nylon 6-6, glass-filled;RoW;kilogram;nylon 6-6, glass-filled;Nylon 66, glass-filled, at plant;RER;kilogram;Nylon 66, glass-filled, at plant
operation, computer, desktop, with liquid crystal display, active mode;CH;hour;operation, computer, desktop, with liquid crystal display, active mode;Use, computer, desktop with LCD monitor, active mode;RER;hour;Use, computer, desktop with LCD monitor, active mode
air separation, cryogenic;RoW;kilogram;oxygen, liquid;Oxygen, liquid, at plant;RER;kilogram;Oxygen, liquid, at plant
packaging box factory construction;RoW;unit;packaging box factory;Packaging box production unit;RER;unit;Packaging box production unit
market for packaging film, low density polyethylene;GLO;kilogram;packaging film, low density polyethylene;Packaging film, LDPE, at plant;RER;kilogram;Packaging film, LDPE, at plant
maintenance, passenger car;RER;unit;passenger car maintenance;Maintenance, passenger car;RER;unit;Maintenance, passenger car
market for pesticide, unspecified;GLO;kilogram;pesticide, unspecified;pesticide unspecified, at regional storehouse/kg;CH;kilogram;pesticide unspecified, at regional storehouse/kg
market for petrol, low-sulfur;Europe without Switzerland;kilogram;petrol, low-sulfur;Petrol, low-sulphur, at refinery;CH;kilogram;Petrol, low-sulphur, at refinery
phenolic resin production;RoW;kilogram;phenolic resin;Phenolic resin, at plant;RER;kilogram;Phenolic resin, at plant
market for phosphate fertiliser, as P2O5;GLO;kilogram;phosphate fertiliser, as P2O5;Ammonium nitrate phosphate, as P2O5, at regional storehouse;RER;kilogram;Ammonium nitrate phosphate, as P2O5, at regional storehouse
market for phosphoric acid, industrial grade, without water, in 85% solution state;GLO;kilogram;phosphoric acid, industrial grade, without water, in 85% solution state;Phosphoric acid, industrial grade, 85% in H2O, at plant;RER;kilogram;Phosphoric acid, industrial grade, 85% in H2O, at plant
market for plastic processing factory;GLO;unit;plastic processing factory;Plastics processing factory;RER;unit;Plastics processing factory
market for platinum;GLO;kilogram;platinum;Platinum, at regional storage;RER;kilogram;Platinum, at regional storage
market for polyethylene terephthalate, granulate, amorphous;GLO;kilogram;polyethylene terephthalate, granulate, amorphous;Polyethylene terephthalate, granulate, amorphous, at plant;RER;kilogram;Polyethylene terephthalate, granulate, amorphous, at plant
market for polyethylene, high density, granulate;GLO;kilogram;polyethylene, high density, granulate;Polyethylene, HDPE, granulate, at plant;RER;kilogram;Polyethylene, HDPE, granulate, at plant
polyethylene production, high density, granulate;RER;kilogram;polyethylene, high density, granulate;Polyethylene, HDPE, granulate, at plant;RER;kilogram;Polyethylene, HDPE, granulate, at plant
market for polyethylene, low density, granulate;GLO;kilogram;polyethylene, low density, granulate;Polyethylene, LDPE, granulate, at plant;RER;kilogram;Polyethylene, LDPE, granulate, at plant
polyethylene production, low density, granulate;RoW;kilogram;polyethylene, low density, granulate;Polyethylene, LDPE, granulate, at plant;RER;kilogram;Polyethylene, LDPE, granulate, at plant
market for polyphenylene sulfide;GLO;kilogram;polyphenylene sulfide;Polyphenylene sulfide, at plant;GLO;kilogram;Polyphenylene sulfide, at plant
market for polypropylene, granulate;GLO;kilogram;polypropylene, granulate;Polypropylene, granulate, at plant;RER;kilogram;Polypropylene, granulate, at plant
market for polyurethane, flexible foam;RER;kilogram;polyurethane, flexible foam;Polyurethane, flexible foam, at plant;RER;kilogram;Polyurethane, flexible foam, at plant
polyvinylchloride production, bulk polymerisation;RER;kilogram;polyvinylchloride, bulk polymerised;Polyvinylchloride, bulk polymerised, at plant;RER;kilogram;Polyvinylchloride, bulk polymerised, at plant
market for polyvinylchloride, suspension polymerised;GLO;kilogram;polyvinylchloride, suspension polymerised;Polyvinylchloride, suspension polymerised, at plant;RER;kilogram;Polyvinylchloride, suspension polymerised, at plant
market for polyvinylfluoride;GLO;kilogram;polyvinylfluoride;polyvinylfluoride, at plant/kg;US;kilogram;polyvinylfluoride, at plant/kg
market for portafer;GLO;kilogram;portafer;Portafer, at plant;RER;kilogram;Portafer, at plant
market for potassium fertiliser, as K2O;GLO;kilogram;potassium fertiliser, as K2O;Potassium nitrate, as K2O, at regional storehouse;RER;kilogram;Potassium nitrate, as K2O, at regional storehouse
market for potassium hydroxide;GLO;kilogram;potassium hydroxide;Potassium hydroxide, at regional storage;RER;kilogram;Potassium hydroxide, at regional storage
market for potassium sulfate, as K2O;GLO;kilogram;potassium sulfate, as K2O;Potassium sulphate, as K2O, at regional storehouse;RER;kilogram;Potassium sulphate, as K2O, at regional storehouse
market for power distribution unit, for electric passenger car;GLO;kilogram;power distribution unit, for electric passenger car;power distribution unit, for electric passenger car;RER;kilogram;power distribution unit, for electric passenger car
market for precious metal refinery;GLO;unit;precious metal refinery;Facilities precious metal refinery;SE;unit;Facilities precious metal refinery
market for printed wiring board, through-hole mounted, unspecified, Pb free;GLO;kilogram;printed wiring board, through-hole mounted, unspecified, Pb free;Printed wiring board, through-hole mounted, unspec., Pb free, at plant;GLO;kilogram;Printed wiring board, through-hole mounted, unspec., Pb free, at plant
market for pump, 40W;GLO;unit;pump, 40W;Pump 40W, at plant;CH;unit;Pump 40W, at plant
pump production, 40W;CH;unit;pump, 40W;Pump 40W, at plant;CH;unit;Pump 40W, at plant
market for quicklime, milled, packed;RER;kilogram;quicklime, milled, packed;Quicklime, milled, packed, at plant;CH;kilogram;Quicklime, milled, packed, at plant
market for reinforcing steel;GLO;kilogram;reinforcing steel;Reinforcing steel, at plant;RER;kilogram;Reinforcing steel, at plant
reinforcing steel production;RoW;kilogram;reinforcing steel;Reinforcing steel, at plant;RER;kilogram;Reinforcing steel, at plant
reinforcing steel production;RER;kilogram;reinforcing steel;Reinforcing steel, at plant;RER;kilogram;Reinforcing steel, at plant
market for road;GLO;meter-year;road;Road;CH;meter-year;Road
market for road wear emissions, passenger car;GLO;kilogram;road wear emissions, passenger car;road wear emissions, passenger car;RER;kilogram;road wear emissions, passenger car
router, internet;CH;unit;router, internet;Router, IP network, at server;CH;unit;Router, IP network, at server
gravel and sand quarry operation;CH;kilogram;sand;Sand, at mine;CH;kilogram;Sand, at mine
treatment of scrap steel, inert material landfill;CH;kilogram;scrap steel;Disposal, steel, 0% water, to inert material landfill;CH;kilogram;Disposal, steel, 0% water, to inert material landfill
market for sheet rolling, aluminium;GLO;kilogram;sheet rolling, aluminium;Sheet rolling, aluminium;RER;kilogram;Sheet rolling, aluminium
sheet rolling, aluminium;RoW;kilogram;sheet rolling, aluminium;Sheet rolling, aluminium;RER;kilogram;Sheet rolling, aluminium
market for sheet rolling, chromium steel;GLO;kilogram;sheet rolling, chromium steel;Sheet rolling, chromium steel;RER;kilogram;Sheet rolling, chromium steel
sheet rolling, chromium steel;RoW;kilogram;sheet rolling, chromium steel;Sheet rolling, chromium steel;RER;kilogram;Sheet rolling, chromium steel
market for sheet rolling, copper;GLO;kilogram;sheet rolling, copper;Sheet rolling, chromium steel;RER;kilogram;Sheet rolling, chromium steel
market for sheet rolling, steel;GLO;kilogram;sheet rolling, steel;Sheet rolling, copper;RER;kilogram;Sheet rolling, copper
sheet rolling, steel;RoW;kilogram;sheet rolling, steel;Sheet rolling, steel;RER;kilogram;Sheet rolling, steel
market for silica sand;GLO;kilogram;silica sand;Sheet rolling, steel;RER;kilogram;Sheet rolling, steel
market for silicon, electronics grade;GLO;kilogram;silicon, electronics grade;silicon, electronic grade, at plant/kg;DE;kilogram;silicon, electronic grade, at plant/kg
market for soap;GLO;kilogram;soap;Soap, at plant;RER;kilogram;Soap, at plant
market for sodium chloride, powder;GLO;kilogram;sodium chloride, powder;Sodium chloride, powder, at plant;RER;kilogram;Sodium chloride, powder, at plant
market for sodium hydroxide, without water, in 50% solution state;GLO;kilogram;sodium hydroxide, without water, in 50% solution state;Sodium hydroxide, 50% in H2O, production mix, at plant;RER;kilogram;Sodium hydroxide, 50% in H2O, production mix, at plant
market for sodium persulfate;GLO;kilogram;sodium persulfate;Sodium persulfate, at plant;GLO;kilogram;Sodium persulfate, at plant
market for soil pH raising agent, as CaCO3;GLO;kilogram;soil pH raising agent, as CaCO3;Limestone, at mine;CH;kilogram;Limestone, at mine
market for steel, chromium steel 18/8;GLO;kilogram;steel, chromium steel 18/8;Chromium steel 18/8, at plant;RER;kilogram;Chromium steel 18/8, at plant
market for steel, chromium steel 18/8, hot rolled;GLO;kilogram;steel, chromium steel 18/8, hot rolled;Sheet rolling, chromium steel;RER;kilogram;Sheet rolling, chromium steel
steel production, chromium steel 18/8, hot rolled;RoW;kilogram;steel, chromium steel 18/8, hot rolled;Sheet rolling, chromium steel;RER;kilogram;Sheet rolling, chromium steel
market for steel, low-alloyed;GLO;kilogram;steel, low-alloyed;Steel, low-alloyed, at plant;RER;kilogram;Steel, low-alloyed, at plant
steel production, converter, low-alloyed;RER;kilogram;steel, low-alloyed;Steel, low-alloyed, at plant;RER;kilogram;Steel, low-alloyed, at plant
steel production, electric, low-alloyed;RER;kilogram;steel, low-alloyed;Steel, low-alloyed, at plant;RER;kilogram;Steel, low-alloyed, at plant
market for steel, low-alloyed, hot rolled;GLO;kilogram;steel, low-alloyed, hot rolled;Steel, low-alloyed, at plant;RER;kilogram;Steel, low-alloyed, at plant
market for steel, unalloyed;GLO;kilogram;steel, unalloyed;Steel, converter, unalloyed, at plant;RER;kilogram;Steel, converter, unalloyed, at plant
market for stone wool, packed;GLO;kilogram;stone wool, packed;Glass wool mat, at plant;CH;kilogram;Glass wool mat, at plant
market for styrene;GLO;kilogram;styrene;Styrene, at plant;RER;kilogram;Styrene, at plant
market for sugar beet seed, for sowing;GLO;kilogram;sugar beet seed, for sowing;Sugar beet seed IP, at regional storehouse;CH;kilogram;Sugar beet seed IP, at regional storehouse
market for sulfur dioxide, liquid;RER;kilogram;sulfur dioxide, liquid;Sulphur dioxide, liquid, at plant;RER;kilogram;Sulphur dioxide, liquid, at plant
market for sulfur hexafluoride, liquid;RER;kilogram;sulfur hexafluoride, liquid;Sulphur hexafluoride, liquid, at plant;RER;kilogram;Sulphur hexafluoride, liquid, at plant
market for sulfuric acid;RER;kilogram;sulfuric acid;Sulphuric acid, liquid, at plant;RER;kilogram;Sulphuric acid, liquid, at plant
sulfuric acid production;RoW;kilogram;sulfuric acid;Sulphuric acid, liquid, at plant;RER;kilogram;Sulphuric acid, liquid, at plant
market for synthetic rubber;GLO;kilogram;synthetic rubber;Synthetic rubber, at plant;RER;kilogram;Synthetic rubber, at plant
synthetic rubber production;RER;kilogram;synthetic rubber;Synthetic rubber, at plant;RER;kilogram;Synthetic rubber, at plant
market for tap water;Europe without Switzerland;kilogram;tap water;tap water, at user/kg;RER;kilogram;tap water, at user/kg
market for tap water;CH;kilogram;tap water;tap water, at user/kg;CH;kilogram;tap water, at user/kg
market for tap water;RoW;kilogram;tap water;tap water, at user/kg;RER;kilogram;tap water, at user/kg
tetrafluoroethylene production;RoW;kilogram;tetrafluoroethylene;tetrafluoroethylene, at plant/kg;RER;kilogram;tetrafluoroethylene, at plant/kg
market for thermoforming, with calendering;GLO;kilogram;thermoforming, with calendering;Thermoforming, with calendering;RER;kilogram;Thermoforming, with calendering
market for tin;GLO;kilogram;tin;Tin, at regional storage;RER;kilogram;Tin, at regional storage
tin production;RoW;kilogram;tin;Tin, at regional storage;RER;kilogram;Tin, at regional storage
market for titanium dioxide;RoW;kilogram;titanium dioxide;Titanium dioxide, production mix, at plant;RER;kilogram;Titanium dioxide, production mix, at plant
market for transformer, high voltage use;GLO;kilogram;transformer, high voltage use;Transformer, high voltage use, at plant;GLO;kilogram;Transformer, high voltage use, at plant
transmission network construction, electricity, high voltage;CH;kilometer;transmission network, electricity, high voltage;transmission network, electricity, high voltage/km;CH;kilometer;transmission network, electricity, high voltage/km
transmission network construction, electricity, medium voltage;CH;kilometer;transmission network, electricity, medium voltage;transmission network, electricity, medium voltage/km;CH;kilometer;transmission network, electricity, medium voltage/km
transmission network construction, long-distance;UCTE;kilometer;transmission network, long-distance;transmission network, long-distance/km;UCTE;kilometer;transmission network, long-distance/km
market for transport, freight train;Europe without Switzerland;ton kilometer;transport, freight train;transport, freight, rail/tkm;RER;ton kilometer;transport, freight, rail/tkm
transport, freight train, diesel, with particle filter;CH;ton kilometer;transport, freight train;transport, freight, rail/tkm;RER;ton kilometer;transport, freight, rail/tkm
market for transport, freight, inland waterways, barge;RER;ton kilometer;transport, freight, inland waterways, barge;transport, barge tanker/tkm;RER;ton kilometer;transport, barge tanker/tkm
transport, freight, inland waterways, barge;RER;ton kilometer;transport, freight, inland waterways, barge;transport, barge tanker/tkm;RER;ton kilometer;transport, barge tanker/tkm
market for transport, freight, lorry >32 metric ton, EURO3;RoW;ton kilometer;transport, freight, lorry >32 metric ton, EURO3;transport, freight, lorry 16-32 metric ton, EURO 6/tkm;RER;ton kilometer;transport, freight, lorry 16-32 metric ton, EURO 6/tkm
market for transport, freight, lorry >32 metric ton, EURO6;RER;ton kilometer;transport, freight, lorry >32 metric ton, EURO6;transport, freight, lorry 16-32 metric ton, EURO 6/tkm;RER;ton kilometer;transport, freight, lorry 16-32 metric ton, EURO 6/tkm
market for transport, freight, lorry 16-32 metric ton, EURO3;RoW;ton kilometer;transport, freight, lorry 16-32 metric ton, EURO3;transport, freight, lorry 16-32 metric ton, EURO 3/tkm;RER;ton kilometer;transport, freight, lorry 16-32 metric ton, EURO 3/tkm
market for transport, freight, lorry 16-32 metric ton, EURO5;RoW;ton kilometer;transport, freight, lorry 16-32 metric ton, EURO5;transport, freight, lorry 16-32 metric ton, EURO 5/tkm;RER;ton kilometer;transport, freight, lorry 16-32 metric ton, EURO 5/tkm
transport, freight, lorry 16-32 metric ton, EURO5;RER;ton kilometer;transport, freight, lorry 16-32 metric ton, EURO5;transport, freight, lorry 16-32 metric ton, EURO 5/tkm;RER;ton kilometer;transport, freight, lorry 16-32 metric ton, EURO 5/tkm
market for transport, freight, lorry, unspecified;RER;ton kilometer;transport, freight, lorry, unspecified;transport, freight, lorry 16-32 metric ton, EURO 5/tkm;RER;ton kilometer;transport, freight, lorry 16-32 metric ton, EURO 5/tkm
market for transport, freight, sea, tanker for liquid goods other than petroleum and liquefied natural gas;GLO;ton kilometer;transport, freight, sea, tanker for liquid goods other than petroleum and liquefied natural gas;transport, transoceanic tanker/tkm;OCE;ton kilometer;transport, transoceanic tanker/tkm
market for transport, freight, sea, tanker for petroleum;GLO;ton kilometer;transport, freight, sea, tanker for petroleum;transport, transoceanic tanker/tkm;OCE;ton kilometer;transport, transoceanic tanker/tkm
transport, helicopter;GLO;hour;transport, helicopter;transport, freight helicopter, single-engine/hr;CH;hour;transport, freight helicopter, single-engine/hr
transport, helicopter, LTO cycle;GLO;unit;transport, helicopter, LTO cycle;transport, helicopter, single-engine, LTO cycle/p;CH;unit;transport, helicopter, single-engine, LTO cycle/p
tube insulation production, elastomere;RoW;kilogram;tube insulation, elastomere;Tube insulation, elastomere, at plant;DE;kilogram;Tube insulation, elastomere, at plant
market for tyre wear emissions, passenger car;GLO;kilogram;tyre wear emissions, passenger car;tyre wear emissions, passenger car;RER;kilogram;tyre wear emissions, passenger car
market for urea, as N;GLO;kilogram;urea, as N;Urea, as N, at regional storehouse;RER;kilogram;Urea, as N, at regional storehouse
market for used powertrain from electric passenger car, manual dismantling;GLO;kilogram;used powertrain from electric passenger car, manual dismantling;disposal, powertrain, for electric passenger car;RER;kilogram;disposal, powertrain, for electric passenger car
market for used vegetable cooking oil;GLO;kilogram;used vegetable cooking oil;Vegetable oil, from waste cooking oil, at plant;CH;kilogram;Vegetable oil, from waste cooking oil, at plant
treatment of waste asphalt, sanitary landfill;RoW;kilogram;waste asphalt;Disposal, asphalt, 0.1% water, to sanitary landfill;CH;kilogram;Disposal, asphalt, 0.1% water, to sanitary landfill
treatment of waste gypsum, inert material landfill;Europe without Switzerland;kilogram;waste gypsum;Disposal, gypsum, 19.4% water, to inert material landfill;CH;kilogram;Disposal, gypsum, 19.4% water, to inert material landfill
treatment of waste mineral oil, hazardous waste incineration;RoW;kilogram;waste mineral oil;Disposal, bilge oil, 90% water, to hazardous waste incineration;CH;kilogram;Disposal, bilge oil, 90% water, to hazardous waste incineration
treatment of waste mineral wool, inert material landfill;CH;kilogram;waste mineral wool, for final disposal;Disposal, building, mineral wool, to final disposal;CH;kilogram;Disposal, building, mineral wool, to final disposal
market for waste plastic, industrial electronics;RoW;kilogram;waste plastic, industrial electronics;disposal, plastic, industr. electronics, 15.3% water, to municipal incineration/kg;CH;kilogram;disposal, plastic, industr. electronics, 15.3% water, to municipal incineration/kg
treatment of waste plastic, mixture, sanitary landfill;RoW;kilogram;waste plastic, mixture;Disposal, plastics, mixture, 15.3% water, to sanitary landfill;CH;kilogram;Disposal, plastics, mixture, 15.3% water, to sanitary landfill
market for waste rubber, unspecified;RoW;kilogram;waste rubber, unspecified;disposal, rubber, unspecified, 0% water, to municipal incineration/kg;CH;kilogram;disposal, rubber, unspecified, 0% water, to municipal incineration/kg
treatment of wastewater, average, capacity 1E9l/year;CH;cubic meter;wastewater, average;Treatment, sewage, from residence, to wastewater treatment, class 2;CH;cubic meter;Treatment, sewage, from residence, to wastewater treatment, class 2
treatment of wastewater, from residence, capacity 1.1E10l/year;RoW;cubic meter;wastewater, from residence;Treatment, sewage, from residence, to wastewater treatment, class 2;CH;cubic meter;Treatment, sewage, from residence, to wastewater treatment, class 2
treatment of wastewater, unpolluted, capacity 5E9l/year;RoW;cubic meter;wastewater, unpolluted;Treatment, sewage, unpolluted, from residence, to wastewater treatment, class 2;CH;cubic meter;Treatment, sewage, unpolluted, from residence, to wastewater treatment, class 2
market for water, completely softened;RER;kilogram;water, completely softened;Water, completely softened, at plant;RER;kilogram;Water, completely softened, at plant
market for water, decarbonised;DE;kilogram;water, decarbonised;Water, decarbonised, at plant;RER;kilogram;Water, decarbonised, at plant
market for water, decarbonised;RoW;kilogram;water, decarbonised;Water, decarbonised, at plant;RER;kilogram;Water, decarbonised, at plant
market for water, deionised;Europe without Switzerland;kilogram;water, deionised;Water, deionised, at plant;CH;kilogram;Water, deionised, at plant
