name;location;unit;reference product;UVEK name;UVEK location;UVEK unit;UVEK ref prod
market for water, deionised;CH;kilogram;water, deionised;Water, deionised, at plant;CH;kilogram;Water, deionised, at plant
market for water, deionised;RoW;kilogram;water, deionised;Water, deionised, at plant;CH;kilogram;Water, deionised, at plant
water production, deionised;Europe without Switzerland;kilogram;water, deionised;Water, deionised, at plant;CH;kilogram;Water, deionised, at plant
market for water, ultrapure;RoW;kilogram;water, ultrapure;Water, ultrapure, at plant;GLO;kilogram;Water, ultrapure, at plant
market for water, ultrapure;RER;kilogram;water, ultrapure;Water, ultrapure, at plant;GLO;kilogram;Water, ultrapure, at plant
market for welding, arc, steel;GLO;meter;welding, arc, steel;Welding, arc, steel;RER;meter;Welding, arc, steel
welding, arc, steel;RoW;meter;welding, arc, steel;Welding, arc, steel;RER;meter;Welding, arc, steel
wire drawing, copper;RoW;kilogram;wire drawing, copper;Wire drawing, copper;RER;kilogram;Wire drawing, copper
market for zeolite, powder;GLO;kilogram;zeolite, powder;Zeolite, powder, at plant;RER;kilogram;Zeolite, powder, at plant
market for zinc oxide;GLO;kilogram;zinc oxide;Zinc oxide, at plant;RER;kilogram;Zinc oxide, at plant
